{
  "type": "github",
  "name": "RTAB-Map",
  "location": "https://github.com/introlab/rtabmap",
  "status": "active",
  "works": true,
  "development": "ongoing",
  "problems": [
    "libpointmatcher dependency (recommended for lidar use) is not available on 32-bit systems"
  ],
  "depends_on": [
    "opencv",
    "pcl",
    "cpp"
  ],
  "tags": [
    "slam",
    "loop-closure-detection",
    "rgb-d",
    "lidar"
  ],
  "source_notes": "RGB-D, stereo, and lidar graph-based SLAM library with real-time constraints, using appearance-based loop closure detection and memory management for long-term operation. Developed at IntRoLab, Université de Sherbrooke, licensed under BSD.",
  "id": "GH-000014"
}
