{
  "type": "github",
  "name": "Nav2 (Navigation2)",
  "location": "https://github.com/ros-navigation/navigation2",
  "status": "active",
  "works": true,
  "development": "ongoing",
  "problems": [
    "behavior tree-based architecture and large plugin ecosystem add configuration complexity for new users"
  ],
  "depends_on": [
    "ros2",
    "behaviortree-cpp",
    "cpp"
  ],
  "tags": [
    "navigation",
    "path-planning",
    "mobile-robots",
    "behavior-trees"
  ],
  "source_notes": "ROS 2 navigation framework and successor to the original ROS Navigation Stack, providing perception, planning, control, and localization for mobile robot navigation. Project leadership by Open Navigation LLC.",
  "id": "GH-000011"
}
