{
  "type": "github",
  "name": "TensorFlow",
  "location": "https://github.com/tensorflow/tensorflow",
  "status": "active",
  "works": true,
  "development": "ongoing",
  "problems": [
    "large build system and long compile times from source",
    "API surface has changed significantly across major versions (1.x graph mode to 2.x eager execution)"
  ],
  "depends_on": [
    "python",
    "cpp",
    "cuda-optional"
  ],
  "tags": [
    "machine-learning",
    "deep-learning",
    "numerical-computation",
    "neural-networks"
  ],
  "source_notes": "End-to-end open-source platform for machine learning, originally developed by the Google Brain team. Licensed under Apache License 2.0.",
  "id": "GH-000024"
}
